{
  "version": 1,
  "endianDefault": "le",
  "frame": { "headerSize": 12, "trailerSize": 0, "lengthIncludesHeader": false, "lengthIncludesTrailer": false },
  "header": [
    { "name": "bodyLen", "offset": 0,  "size": 4, "type": "u32", "endian": "le", "role": "length" },
    { "name": "errCode", "offset": 4,  "size": 2, "type": "u16", "role": "errorCode" },
    { "name": "cmd",     "offset": 6,  "size": 1, "type": "u8",  "role": "route" },
    { "name": "act",     "offset": 7,  "size": 1, "type": "u8",  "role": "route" },
    { "name": "index",   "offset": 8,  "size": 2, "type": "u16", "role": "value",
      "source": { "kind": "const", "value": 0 } },
    { "name": "flags",   "offset": 10, "size": 1, "type": "u8",  "role": "flags",
      "bits": [ { "name": "encrypted", "bit": 0 } ] },
    { "name": "bcc",     "offset": 11, "size": 1, "type": "u8",  "role": "reserved" }
  ],
  "routeKeyTemplate": "{cmd}:{act}",
  "pipeline": [],
  "heartbeat": {
    "intervalMs": 3000,
    "route": { "cmd": 2, "act": 1 },
    "heartbeatFields": [
      { "type": "u32", "source": "counter", "start": 1, "step": 1 },
      { "type": "u64", "source": "timestamp", "unit": "ms" }
    ]
  }
}
